index,orig,reasonIndex,reason,resultIndex,result,category1,category2
132,#1 神経系を支配する法則を明らかにするために， #2 いろいろな材料が使われてきました。 #3 代表的な生物は，ヒゲカビ，ヒドラ，ヒル，アメフラシ，ショウジョウバエ，ネズミなどです。 #4 材料の条件としては，個々のニューロンを特定できること，ニューロンと行動の関係が明らかにできること，そして，ニューロンを制御する分子を明らかにできることが必要です。 #5 しかし，このような条件を満たす材料は限られています。 #6 線虫は，そうした条件を満たす数少ない材料のひとつです。 #7 線虫はわずか302個のニューロンで構成され， #8 すべてのニューロンを生きたまま同定することができます。 #9 さらに，行動とニューロンの対応がつき， #10 関与する遺伝子から分子を明らかにすることができるからです。,#9,さらに，行動とニューロンの対応がつき，,#10,関与する遺伝子から分子を明らかにすることができるからです。,explicit,原因・理由  
137,#1 ニューロンはじつに多様で， #2 形態，シナプス接合，伝達物質のちがいなどから，273種類に分類されます。 #3 全部で302個ですので， #4 それぞれが個性をもったニューロンであることがわかります。 #5 ニューロンが個性をもてる理由のひとつは，細胞の系譜にあります。 #6 腸管細胞など単一の創始細胞に由来するニューロンは，複数の創始細胞から派生します。 #7 また分裂様式も異なっていて， #8 クローン性ではなく #9 反復性です。 #10 クローン性では，単純な2分割によって2つの単一種の娘細胞が生じますが， #11 反復性では，親型とともに新しい型の娘細胞が生じます。,#3,全部で302個ですので，,#4,それぞれが個性をもったニューロンであることがわかります。,explicit,原因・理由  
140,#1 こうした発生段階には，多くの遺伝子がはたらいていることがわかってきました。 #2 lin−12遺伝子は，最初の段階すなわち外胚葉精細胞から神経芽細胞が生ずる段階にはたらきます。 #3 そのとき， #4 lin−12遺伝子は，自分自身を発現した細胞のみを神経細胞へ導き， #5 隣接する細胞が神経になるのを抑制していると思われます（図5）。 #6 多くの神経は単独ではなく， #7 ファシクリン・タンパク質のような特定物質を分泌しあって #8 束になります。 #9 突起の先端の成長円錐は，途中にあるラミニン・タンパク質などの案内物質を目印にして， #10 最終地点に到達します。 #11 もし，神経の突端が正確に案内物質を認識できないと， #12 神経突起がフラフラして #13 行き先が定まらなくなります。 #14 成長円錐が最終地点に達すると， #15 そこで形を変え， #16 シナプスを形成します。,#7,ファシクリン・タンパク質のような特定物質を分泌しあって,#8,束になります。,implicit,原因・理由  
140,#1 こうした発生段階には，多くの遺伝子がはたらいていることがわかってきました。 #2 lin−12遺伝子は，最初の段階すなわち外胚葉精細胞から神経芽細胞が生ずる段階にはたらきます。 #3 そのとき， #4 lin−12遺伝子は，自分自身を発現した細胞のみを神経細胞へ導き， #5 隣接する細胞が神経になるのを抑制していると思われます（図5）。 #6 多くの神経は単独ではなく， #7 ファシクリン・タンパク質のような特定物質を分泌しあって #8 束になります。 #9 突起の先端の成長円錐は，途中にあるラミニン・タンパク質などの案内物質を目印にして， #10 最終地点に到達します。 #11 もし，神経の突端が正確に案内物質を認識できないと， #12 神経突起がフラフラして #13 行き先が定まらなくなります。 #14 成長円錐が最終地点に達すると， #15 そこで形を変え， #16 シナプスを形成します。,#12,神経突起がフラフラして,#13,行き先が定まらなくなります。,implicit,原因・理由  
145,#1 シナプス伝達では，シナプス小胞が重要な役割をしています。 #2 商法の役割を明らかにするため， #3 突然変異を起こした線虫が分離されました（図7）。 #4 分離方法は，次のような考えに基づいています。 #5 すなわち，商法に含まれる伝達物質の一種のアセチルコリンは，放出されると #6 後シナプス膜の受容体に結合します。 #7 しかし，分解酵素であるアセチルコリンエステラーゼによってすみやかに分解されないと， #8 線虫は死んでしまいます。 #9 農薬の多くは有機リン剤ですが， #10 それは有機リンがアセチルコリンエステラーゼのはたらきを阻害して， #11 強力な殺虫剤となることを利用したものです。 #12 逆に，アセチルコリンが放出されなければ， #13 阻害剤に抵抗性になると予想されます。 #14 こうした考えのもとに多くの変異体が分離され， #15 その遺伝子が同定されました。 #16 変異体はいずれも，ほとんど運動能力を失っていました。 #17 いくつかの遺伝子変異は，アセチルコリンの放出能も失っていました。 #18 さらに詳しく調べた結果， #19 unc−104遺伝子は軸索での小胞の輸送に，cha−1 はアセチルコリンの合成に，unc−17 はアセチルコリンの小胞への取り込みに，unc−13，unc−18，snt−1は小胞の形質膜相互作用に，はたらいていることがわかりました。,#2,商法の役割を明らかにするため，,#3,突然変異を起こした線虫が分離されました。,explicit,目的  
145,#1 シナプス伝達では，シナプス小胞が重要な役割をしています。 #2 商法の役割を明らかにするため， #3 突然変異を起こした線虫が分離されました（図7）。 #4 分離方法は，次のような考えに基づいています。 #5 すなわち，商法に含まれる伝達物質の一種のアセチルコリンは，放出されると #6 後シナプス膜の受容体に結合します。 #7 しかし，分解酵素であるアセチルコリンエステラーゼによってすみやかに分解されないと， #8 線虫は死んでしまいます。 #9 農薬の多くは有機リン剤ですが， #10 それは有機リンがアセチルコリンエステラーゼのはたらきを阻害して， #11 強力な殺虫剤となることを利用したものです。 #12 逆に，アセチルコリンが放出されなければ， #13 阻害剤に抵抗性になると予想されます。 #14 こうした考えのもとに多くの変異体が分離され， #15 その遺伝子が同定されました。 #16 変異体はいずれも，ほとんど運動能力を失っていました。 #17 いくつかの遺伝子変異は，アセチルコリンの放出能も失っていました。 #18 さらに詳しく調べた結果， #19 unc−104遺伝子は軸索での小胞の輸送に，cha−1 はアセチルコリンの合成に，unc−17 はアセチルコリンの小胞への取り込みに，unc−13，unc−18，snt−1は小胞の形質膜相互作用に，はたらいていることがわかりました。,#7,しかし，分解酵素であるアセチルコリンエステラーゼによってすみやかに分解されないと，,#8,線虫は死んでしまいます。,explicit,原因・理由  
145,#1 シナプス伝達では，シナプス小胞が重要な役割をしています。 #2 商法の役割を明らかにするため， #3 突然変異を起こした線虫が分離されました（図7）。 #4 分離方法は，次のような考えに基づいています。 #5 すなわち，商法に含まれる伝達物質の一種のアセチルコリンは，放出されると #6 後シナプス膜の受容体に結合します。 #7 しかし，分解酵素であるアセチルコリンエステラーゼによってすみやかに分解されないと， #8 線虫は死んでしまいます。 #9 農薬の多くは有機リン剤ですが， #10 それは有機リンがアセチルコリンエステラーゼのはたらきを阻害して， #11 強力な殺虫剤となることを利用したものです。 #12 逆に，アセチルコリンが放出されなければ， #13 阻害剤に抵抗性になると予想されます。 #14 こうした考えのもとに多くの変異体が分離され， #15 その遺伝子が同定されました。 #16 変異体はいずれも，ほとんど運動能力を失っていました。 #17 いくつかの遺伝子変異は，アセチルコリンの放出能も失っていました。 #18 さらに詳しく調べた結果， #19 unc−104遺伝子は軸索での小胞の輸送に，cha−1 はアセチルコリンの合成に，unc−17 はアセチルコリンの小胞への取り込みに，unc−13，unc−18，snt−1は小胞の形質膜相互作用に，はたらいていることがわかりました。,#18,さらに詳しく調べた結果，,#19,unc−104遺伝子は軸索での小胞の輸送に，cha−1 はアセチルコリンの合成に，unc−17 はアセチルコリンの小胞への取り込みに，unc−13，unc−18，snt−1は小胞の形質膜相互作用に，はたらいていることがわかりました。,explicit,原因・理由  
145,#1 シナプス伝達では，シナプス小胞が重要な役割をしています。 #2 商法の役割を明らかにするため， #3 突然変異を起こした線虫が分離されました（図7）。 #4 分離方法は，次のような考えに基づいています。 #5 すなわち，商法に含まれる伝達物質の一種のアセチルコリンは，放出されると #6 後シナプス膜の受容体に結合します。 #7 しかし，分解酵素であるアセチルコリンエステラーゼによってすみやかに分解されないと， #8 線虫は死んでしまいます。 #9 農薬の多くは有機リン剤ですが， #10 それは有機リンがアセチルコリンエステラーゼのはたらきを阻害して， #11 強力な殺虫剤となることを利用したものです。 #12 逆に，アセチルコリンが放出されなければ， #13 阻害剤に抵抗性になると予想されます。 #14 こうした考えのもとに多くの変異体が分離され， #15 その遺伝子が同定されました。 #16 変異体はいずれも，ほとんど運動能力を失っていました。 #17 いくつかの遺伝子変異は，アセチルコリンの放出能も失っていました。 #18 さらに詳しく調べた結果， #19 unc−104遺伝子は軸索での小胞の輸送に，cha−1 はアセチルコリンの合成に，unc−17 はアセチルコリンの小胞への取り込みに，unc−13，unc−18，snt−1は小胞の形質膜相互作用に，はたらいていることがわかりました。,#14,こうした考えのもとに多くの変異体が分離され，,#15,その遺伝子が同定されました。,implicit,原因・理由  
147,#1 このように，シナプス小胞から伝達物質が放出されるには， #2 小胞が前シナプス膜に結合し， #3 続いて #4 膜どうしが融合することが必要です。 #5 結合に関しては， #6 シナプス小胞のシナプトブレビンと前シナプス膜のシンタキシンが，細胞質のNSF（N−エチルマレイミド感受性融合因子）とSNAP（可溶性NSF付着タンパク質）を介して #7 複合体を形成し， #8 小胞が前シナプス膜に結合します。 #9 続いて起こる融合に関しては， #10 カルシウムイオンが重要な役割をしています。 #11 カルシウムイオンが電位依存性のカルシウムチャンネルを通って #12 神経終末に流入すると， #13 小胞の膜タンパク質のシナプトフィジンと形質膜のフィゾフィリンとがいっしょになって， #14 チャンネルを形成します。 #15 unc−13遺伝子がコードするタンパク質は，カルシウムイオンのセンサーとしてはたらきます。 #16 また，シナプトタグミンやシンタキシンは，カルシウムチャンネルと複合体を形成して， #17 小胞を活性部域へつなぎとめる役割をしています。,#13,小胞の膜タンパク質のシナプトフィジンと形質膜のフィゾフィリンとがいっしょになって，,#14,チャンネルを形成します。,implicit,原因・理由  
150,#1 線虫は，神経系の中枢とされる部分に200個前後のニューロンしかありません。 #2 こんな原始的な生物に，はたして学習し， #3 記憶する能力が備わっているのでしょうか。 #4 線虫が入っているシャーレを軽くたたくと， #5 線虫はちょっとだけ後退します。 #6 この現象をタップ反応といいます。 #7 タップ刺激による後退は3秒ほどで， #8 すぐに正常運動に戻ります。 #9 くり返し #10 タップ刺激を与えると， #11 後退は続けますが， #12 20秒ほどで反応が弱まり， #13 いわゆる「慣れ」（habituation）が見られるようになります。 #14 タップ刺激のあとで有害な電気刺激を与えると， #15 タップ反応は増強され， #16 単一タップにより強く反応（これを感作といいます）するようになります。 #17 この例から，線虫は学習の基本行動を備えていると考えられます。,#7,タップ刺激による後退は3秒ほどで，,#8,すぐに正常運動に戻ります。,implicit,原因・理由  
151,#1 では，どのような神経回路網がタップ反応にはたらいているのでしょうか。 #2 これまで分離されている変異体を使って調べたところ， #3 mec−3やmec4遺伝子が欠損すると， #4 タップ反応を示さないことがわかりました。 #5 mec−3やmec−4遺伝子は本来，タッチ（触覚）刺激にはたらく遺伝子として同定されました。 #6 したがって，タップ刺激によって線虫が移動運動から反転反応に転ずるのは，タッチニューロンが介在していると考えられます（図8）。 #7 タッチ反応にはたらく神経系回路網は，すでに明らかにされています。,#3,mec−3やmec4遺伝子が欠損すると，,#4,タップ反応を示さないことがわかりました。,explicit,原因・理由  
151,#1 では，どのような神経回路網がタップ反応にはたらいているのでしょうか。 #2 これまで分離されている変異体を使って調べたところ， #3 mec−3やmec4遺伝子が欠損すると， #4 タップ反応を示さないことがわかりました。 #5 mec−3やmec−4遺伝子は本来，タッチ（触覚）刺激にはたらく遺伝子として同定されました。 #6 したがって，タップ刺激によって線虫が移動運動から反転反応に転ずるのは，タッチニューロンが介在していると考えられます（図8）。 #7 タッチ反応にはたらく神経系回路網は，すでに明らかにされています。,#5,mec−3やmec−4遺伝子は本来，タッチ刺激にはたらく遺伝子として同定されました。,#6,したがって，タップ刺激によって線虫が移動運動から反転反応に転ずるのは，タッチニューロンが介在していると考えられます。,explicit,原因・理由  
152,#1 タッチ刺激は，からだの表面近くに散在する6つの感覚ニューロン（AVM，ALML，ALMR，PVM，PLML，PLMR）で受容されます。 #2 次いで，刺激は5つの介在ニューロン（LUA，AVB，AVA，PVC，AVD）で統合され， #3 運動ニューロン（B，A，AS）へ伝えられます。 #4 線虫は，運動ニューロンが支配する筋肉のはたらきで， #5 前進したり #6 後退したりします。 #7 タップ刺激は，頭部へタッチ刺激を与えた場合に似ています。 #8 タップ刺激を与えると， #9 頭部に触れた場合と同じように，前進している線虫が後退するようになります。 #10 しかし，刺激受容の様式は明らかに異なります。 #11 頭部タッチはALMニューロンのみを刺激します。 #12 それに対して， #13 タップは6つの感覚ニューロンすべてを刺激します。 #14 線虫が後退するのは，ALMニューロンの刺激受容が，他の感覚ニューロンからの受容に勝っているためです。 #15 レーザー光線を使って #16 細胞をこわすと， #17 ALMニューロンで受容された刺激は，AVDを含む5つの介在ニューロンで統合され， #18 A運動ニューロンが筋肉を刺激して， #19 後退することがわかりました。 #20 このように，タッチとタップ刺激は，ほとんど同じ神経回路網で受容され， #21 刺激の統合は介在ニューロンで行われていると考えられます。,#18,A運動ニューロンが筋肉を刺激して，,#19,後退することがわかりました。,implicit,原因・理由  
154,#1 記憶の形成に遺伝子の発現が必須であることは，ますます確かなものとなってきました。 #2 ショウジョウバエや哺乳類で，この機構が調べられています（図9）。 #3 それによると，ニューロンが外界の刺激を受けると， #4 遺伝子の発現に先立って， #5 Gタンパク質とカルモジュリンキナーゼが活性化します。 #6 これがアデニル酸シクラーゼを活性化し， #7 サイクリックAMPの合成を促進します。 #8 サイクリックAMPはプロテインキナーゼAを活性化し， #9 これがCREBタンパク質をリン酸化します。 #10 リン酸化されたCREBタンパク質はCBPタンパク質と複合体をつくり， #11 記憶に必須な遺伝子の発現の調節にはたらきます。 #12 線虫には，Gタンパク質，アデニル酸シクラーゼ，プロテインキナーゼA，CBPタンパク質の存在が確認されています。 #13 したがって，この記憶形成のカスケードがはたらいていることは確かですが， #14 詳細は今後の進展を待たなければなりません。,#3,それによると，ニューロンが外界の刺激を受けると，,#5,Gタンパク質とカルモジュリンキナーゼが活性化します。,explicit,原因・理由  
154,#1 記憶の形成に遺伝子の発現が必須であることは，ますます確かなものとなってきました。 #2 ショウジョウバエや哺乳類で，この機構が調べられています（図9）。 #3 それによると，ニューロンが外界の刺激を受けると， #4 遺伝子の発現に先立って， #5 Gタンパク質とカルモジュリンキナーゼが活性化します。 #6 これがアデニル酸シクラーゼを活性化し， #7 サイクリックAMPの合成を促進します。 #8 サイクリックAMPはプロテインキナーゼAを活性化し， #9 これがCREBタンパク質をリン酸化します。 #10 リン酸化されたCREBタンパク質はCBPタンパク質と複合体をつくり， #11 記憶に必須な遺伝子の発現の調節にはたらきます。 #12 線虫には，Gタンパク質，アデニル酸シクラーゼ，プロテインキナーゼA，CBPタンパク質の存在が確認されています。 #13 したがって，この記憶形成のカスケードがはたらいていることは確かですが， #14 詳細は今後の進展を待たなければなりません。,#12,線虫には，Gタンパク質，アデニル酸シクラーゼ，プロテインキナーゼA，CBPタンパク質の存在が確認されています。,#13,したがって，この記憶形成のカスケードがはたらいていることは確かですが，,explicit,原因・理由  
159,#1 神経系の機能には，ニューロンの質だけでなく数が重要であることをはじめに強調しました。 #2 生物は，ニューロンの数をふやすことによって，多様な刺激に対応してきました。 #3 神経科学の目標は，人の脳の理解にせまることです。 #4 10＾2程度のニューロンからなる線虫を調べることによって，神経系を支配?する基本則を見つけられると #5 期待できます。 #6 より高次の神経機能を知るため， #7 ショウジョウバエの臭い学習が調べられています。 #8 臭いに対するハエの学習を制御しているのは，きのこ体（mushroon body）です。 #9 ショウジョウバエの中枢神経系のニューロンのうち，きのこ体のニューロンは10＾3程度です。 #10 一方，霊長類での能の研究は，視覚系（visual cortex）が注目されています。 #11 視覚系のニューロンの数は10＾4程度です。 #12 このように，研究対象の材料のニューロンの数が1桁ずつふえているのはとてもおもしろいことです。,#6,より高次の神経機能を知るため，,#7,ショウジョウバエの臭い学習が調べられています。,explicit,目的  
160,#1 生命科学は，DNAの二重らせん構造の発見が一時期を画しました。 #2 そして，1960年台半ば，神経機能の解明が次の大きな目標となりました。 #3 研究材料の選択の根底には，遺伝子を重視するか， #4 細胞を選ぶかのちがいがあるように思われます。 #5 実際には，それぞれの利点を生かして明らかにされた知識を相補うように研究が進められてきました。 #6 外胚葉からのニューロンの分化，ニューロン間の特異的なシナプスの形成，完成したシナプスでの刺激伝達について，多くのことが理解されつつあります。 #7 記憶についても，短期記憶は，シナプス構成因子とくにチャンネル分子の修飾が必要であることがわかりました。 #8 また，長期記憶は遺伝子の発現が必須であることが明らかになりました。 #9 しかし，より詳細は今後の進展を待たなければなりません。,#3,研究材料の選択の根底には，遺伝子を重視するか，,#4,細胞を選ぶかのちがいがあるように思われます。,implicit,目的  
164,#1 では，A（アデニン），T（チミン），G（グアニン），C（シトシン）の並びである塩基配列をもとに，どのようにして #2 生物ができるのでしょうか。 #3 DNAの遺伝情報がRNAに転写されたあとにタンパク質に翻訳されることを，皆さんはすでにご存じでしょう。 #4 そして，何千・何万種類のタンパク質がはたらきあった結果， #5 生体ができるのです。 #6 この「タンパク質のはたらきあい」を解析するには，どのような方法を用いればよいのでしょうか。 #7 現在，もっとも確実な方法は，DNAの遺伝情報を少し変え， #8 その結果， #9 生物の発生や機能がどのように変わるかを調べる，遺伝学実験を中心とした方法です（図1）。 #10 この方法では，生物の特定の機能にはどのような遺伝子群が関与しているか， #11 機能を達成するために #12 それらの遺伝子はいつどこで発現するのか， #13 それらの遺伝子産物は実際にどのような順序ではたらくか，といって #14 問題をひとつひとつ解いていきます。,#4,そして，何千・何万種類のタンパク質がはたらきあった結果，,#5,生体ができるのです。,explicit,原因・理由  
164,#1 では，A（アデニン），T（チミン），G（グアニン），C（シトシン）の並びである塩基配列をもとに，どのようにして #2 生物ができるのでしょうか。 #3 DNAの遺伝情報がRNAに転写されたあとにタンパク質に翻訳されることを，皆さんはすでにご存じでしょう。 #4 そして，何千・何万種類のタンパク質がはたらきあった結果， #5 生体ができるのです。 #6 この「タンパク質のはたらきあい」を解析するには，どのような方法を用いればよいのでしょうか。 #7 現在，もっとも確実な方法は，DNAの遺伝情報を少し変え， #8 その結果， #9 生物の発生や機能がどのように変わるかを調べる，遺伝学実験を中心とした方法です（図1）。 #10 この方法では，生物の特定の機能にはどのような遺伝子群が関与しているか， #11 機能を達成するために #12 それらの遺伝子はいつどこで発現するのか， #13 それらの遺伝子産物は実際にどのような順序ではたらくか，といって #14 問題をひとつひとつ解いていきます。,#11,機能を達成するために,#12,それらの遺伝子はいつどこで発現するのか，,explicit,目的  
