index,orig,reasonIndex,reason,resultIndex,result,category1,category2
1,#1 生物学は，多くの種類の生き物のの分類や生理・発生などの複雑な現象の記載を中心に発展してきました。 #2 今から約50年前に，細菌からヒトにいたるまで #3 共通の分子の言葉を使って #4 生命現象を解き明かす「分子生物学」が流星のごとく登場しました。 #5 分子生物学の与えたインパクトは強烈で， #6 多くの点でそれまでの生物像を大きく塗り替えました。 #7 分子生物学は，個別の生命現象を分子のレベルで解析することには成功しましたが， #8 しかし残念なことに，そこからは生きた生物の姿が消えてしまいました。 #9 最も簡単な単細胞生物でさえ，その全体像を分子のレベルで理解することはできませんでした。 #10 このような状況のなか，乖離してしまった分子と生物とを融合させて， #11 生物の構造と機能の全体像を分子レベルで明らかにしようという新しい生物学が生まれつつあります。 #12 その融合を仲介するのが，ゲノム研究なのです。 #13 私は，ゲノム研究を基盤にした新しい生物学を「ネオ生物学」という名前でよびたいと考えました。,#10,このような状況のなか，乖離してしまった分子と生物とを融合させて，,#11,生物の構造と機能の全体像を分子レベルで明らかにしようという新しい生物学が生まれつつあります。,implicit,目的  
2,#1 ゲノムとは，個々の生物が細胞の核にもっている遺伝情報の総体をさします。 #2 普通の動植物の細胞は，雌雄の生殖細胞が融合した2倍体の核をもち， #3 性染色体以外は相同の染色体が対になっていますので， #4 そのうちの一組の性染色体を加えたものを「ゲノム」と定義します。 #5 ヒトの場合，22本の常染色体とX，Yの性染色体を合わせて， #6 ヒトゲノムといいます。 #7 このゲノムの上に，メンデル以来100年にわたって探求されつづけてきた「遺伝子」が乗っているのです。 #8 ヒトでは，ゲノムDNAのほぼ5％が遺伝子だといわれています。,#3,性染色体以外は相同の染色体が対になっていますので，,#4,そのうちの一組の性染色体を加えたものを「ゲノム」と定義します。,explicit,原因・理由  
3,#1 遺伝学が限られた数の遺伝子を研究してきたのに対して， #2 ゲノム研究はゲノムに書かれているすべての情報を解読することを目的としています。 #3 これは，ゲノムをになっている物質でもあるDNAの研究が急速に進んで， #4 DNAの構造であるA，T，G，Cの塩基配列を決定する技術が開発され， #5 ゲノム上にあるすべての遺伝子の構造だけでなく，遺伝子と遺伝子にはさまれた部分のDNAも，すべて塩基配列として読み取ることができるようになったからです。 #6 その結果， #7 大腸菌，酵母，ショウジョウバエ，ヒトといった，それぞれの生物に固有の遺伝情報のすべてが明らかになるのです。 #8 種を越えて #9 共通な情報と，種に特殊な情報とが明らかになるでしょう。 #10 ゲノムの構造が決定され， #11 そこにあるすべての遺伝子の構造が明らかになると， #12 次はひとつひとつの遺伝子のはたらきを明らかにするための挑戦が始まります。 #13 この情報の宝箱の中に，想像もしなかった新しい遺伝子が発見されるという期待と，全遺伝子がつくるタンパク質の総和によって試験管の中で細胞を構築し，あるいは #14 コンピュータの中でシミュレートするという夢を追い求めることができるようになるのです。,#4,DNAの構造であるA，T，G，Cの塩基配列を決定する技術が開発され，,#5,ゲノム上にあるすべての遺伝子の構造だけでなく，遺伝子と遺伝子にはさまれた部分のDNAも，すべて塩基配列として読み取ることができるようになったからです。,explicit,原因・理由  
7,#1 生物は遺伝子のはたらきでつくられます。 #2 生物をつくるためのすべての遺伝子情報のセットを「ゲノム」とよびます。 #3 部品と設計図といってもいいかもしれません。 #4 遺伝子の数は最近では4000，本書で紹介する線虫は1万ちょっと，ヒトやマウスでは5〜10万といわれています。 #5 大きな数のように思えますが， #6 これですべてのことをやっているのですから， #7 意外に少ないようにも思えます。 #8 自動車の部品でも全部で数万点ありますが， #9 小さな虫のほうがずっと高級です。 #10 虫は危険を察知して #11 さっさと逃げますが， #12 自動車ではまだまだそうはいきません。 #13 また，自己増殖するのが生物ですから， #14 部品だけではなく工具や工作機械，さらには工場も自前です。 #15 無限とも思える多くのことを生物はこなしているのですが， #16 実際のところは有限の数の遺伝情報でまかなわれているわけです。 #17 よほど巧妙な「しかけ」があるにちがいありません。,#6,これですべてのことをやっているのですから，,#7,意外に少ないようにも思えます。,explicit,原因・理由  
7,#1 生物は遺伝子のはたらきでつくられます。 #2 生物をつくるためのすべての遺伝子情報のセットを「ゲノム」とよびます。 #3 部品と設計図といってもいいかもしれません。 #4 遺伝子の数は最近では4000，本書で紹介する線虫は1万ちょっと，ヒトやマウスでは5〜10万といわれています。 #5 大きな数のように思えますが， #6 これですべてのことをやっているのですから， #7 意外に少ないようにも思えます。 #8 自動車の部品でも全部で数万点ありますが， #9 小さな虫のほうがずっと高級です。 #10 虫は危険を察知して #11 さっさと逃げますが， #12 自動車ではまだまだそうはいきません。 #13 また，自己増殖するのが生物ですから， #14 部品だけではなく工具や工作機械，さらには工場も自前です。 #15 無限とも思える多くのことを生物はこなしているのですが， #16 実際のところは有限の数の遺伝情報でまかなわれているわけです。 #17 よほど巧妙な「しかけ」があるにちがいありません。,#13,また，自己増殖するのが生物ですから，,#14,部品だけではなく工具や工作機械，さらには工場も自前です。,explicit,原因・理由  
9,#1 線虫の特色は，何といっても「全部見える」ことです。 #2 受精卵から成虫にいたる全発生過程を顕微鏡で見ることができるのです。 #3 体細胞の数はたった1000程度なのですが， #4 神経系，筋肉系，消化管，上皮など，動物としての基本的な体制をちゃんともっていて， #5 それこそ危険を察知して逃げまわります。 #6 これをたった300個の神経細胞でやりこなしているのです。 #7 どうやって情報処理しているのでしょうか。 #8 また，1個の受精卵が1000個の細胞へ，どうやって分化していくのでしょうか。 #9 顕微鏡下のドラマを眺めていると興味がつきることがありません。 #10 動物としては下等すぎるのではないかとも思えますが， #11 そうでもありません。 #12 遺伝子の配列はヒトともよく似ていますし， #13 ヒト遺伝子との交換が可能なものもあるくらいです。,#4,神経系，筋肉系，消化管，上皮など，動物としての基本的な体制をちゃんともっていて，,#5,それこそ危険を察知して逃げまわります。,implicit,原因・理由  
10,#1 「全部見える」ということは，科学的にはとても重要なことです。 #2 個々の現象をつねに全体の中に位置づけられるようになるからです。 #3 線虫の研究では，全細胞の分裂パターン，全神経の回路網といった全体像についての，とてつもなく大きな基盤情報が明らかにされ， #4 これらを軸に多くの研究者が情報を共有し #5 研究を進めてきました。 #6 そして，今年あるいは来年には大きな節目を迎えることになります。 #7 ゲノムの全塩基配列決定がほぼ完了するからです。 #8 どれだけの遺伝子があるのか #9 わかりますし，また #10 遺伝子発現パターンの解析も大きく進んでいます。 #11 これまではひとつひとつ工夫をこらして #12 遺伝子の解析を行なってきたのが，これからは様相がちがってくるはずです。 #13 「この現象はこれだけの遺伝子で実行されている」となると， #14 研究方法が変わってくるでしょう。 #15 まさに「1000個の細胞の織りなすシンフォニー」の楽譜を読みとることになるのです。 #16 それができた暁には，楽譜を少し変えてみて #17 どんな曲になるのか， #18 生命のシミュレーションが次のターゲットになるにちがい #19 ありません。,#13,「この現象はこれだけの遺伝子で実行されている」となると，,#14,研究方法が変わってくるでしょう。,explicit,原因・理由  
10,#1 「全部見える」ということは，科学的にはとても重要なことです。 #2 個々の現象をつねに全体の中に位置づけられるようになるからです。 #3 線虫の研究では，全細胞の分裂パターン，全神経の回路網といった全体像についての，とてつもなく大きな基盤情報が明らかにされ， #4 これらを軸に多くの研究者が情報を共有し #5 研究を進めてきました。 #6 そして，今年あるいは来年には大きな節目を迎えることになります。 #7 ゲノムの全塩基配列決定がほぼ完了するからです。 #8 どれだけの遺伝子があるのか #9 わかりますし，また #10 遺伝子発現パターンの解析も大きく進んでいます。 #11 これまではひとつひとつ工夫をこらして #12 遺伝子の解析を行なってきたのが，これからは様相がちがってくるはずです。 #13 「この現象はこれだけの遺伝子で実行されている」となると， #14 研究方法が変わってくるでしょう。 #15 まさに「1000個の細胞の織りなすシンフォニー」の楽譜を読みとることになるのです。 #16 それができた暁には，楽譜を少し変えてみて #17 どんな曲になるのか， #18 生命のシミュレーションが次のターゲットになるにちがい #19 ありません。,#11,これまではひとつひとつ工夫をこらして,#12,遺伝子の解析を行なってきたのが，これからは様相がちがってくるはずです。,implicit,原因・理由  
26,#1 では，線虫というのは，いったいどんな生物なのでしょうか。 #2 線虫の種類はたいへん多いのです。 #3 たとえば，寄生虫の回虫が線虫の仲間です。 #4 また，松枯れ病の原因である松食い虫に寄生するマツノザイセンチュウも仲間です。 #5 寄生虫ですから， #6 医学の1分野として古くから興味がもたれて研究されてきました。 #7 また，受精卵の発生が早く再現性が高いこと，細胞数が少ないことなどから，発生観察の材料として19世紀にはすでに研究されています。 #8 たとえば，ウマカイチュウの卵の研究から，生殖系の細胞と体細胞系の細胞との区別が発生初期に起きることや，体細胞系の細胞で染色体削減が見られることなど，発生学の古典的な研究が行なわれました。 #9 しかしその後，実験発生学は両生類を使って発展し， #10 遺伝学はショウジョウバエを使って発展したため， #11 生物学の材料として線虫は忘れられた存在になってしまいました。 #12 移植実験や再生実験ができなかったことや，その当時，線虫は寄生性のものが使われていたため， #13 遺伝解析には向かなかったからです。,#8,たとえば，ウマカイチュウの卵の研究から，生殖系の細胞と体細胞系の細胞との区別が発生初期に起きることや，体細胞系の細胞で染色体削減が見られることなど，発生学の古典的な研究が行なわれました。,#13,遺伝解析には向かなかったからです。,explicit,原因・理由  
26,#1 では，線虫というのは，いったいどんな生物なのでしょうか。 #2 線虫の種類はたいへん多いのです。 #3 たとえば，寄生虫の回虫が線虫の仲間です。 #4 また，松枯れ病の原因である松食い虫に寄生するマツノザイセンチュウも仲間です。 #5 寄生虫ですから， #6 医学の1分野として古くから興味がもたれて研究されてきました。 #7 また，受精卵の発生が早く再現性が高いこと，細胞数が少ないことなどから，発生観察の材料として19世紀にはすでに研究されています。 #8 たとえば，ウマカイチュウの卵の研究から，生殖系の細胞と体細胞系の細胞との区別が発生初期に起きることや，体細胞系の細胞で染色体削減が見られることなど，発生学の古典的な研究が行なわれました。 #9 しかしその後，実験発生学は両生類を使って発展し， #10 遺伝学はショウジョウバエを使って発展したため， #11 生物学の材料として線虫は忘れられた存在になってしまいました。 #12 移植実験や再生実験ができなかったことや，その当時，線虫は寄生性のものが使われていたため， #13 遺伝解析には向かなかったからです。,#10,遺伝学はショウジョウバエを使って発展したため，,#11,生物学の材料として線虫は忘れられた存在になってしまいました。,explicit,原因・理由  
26,#1 では，線虫というのは，いったいどんな生物なのでしょうか。 #2 線虫の種類はたいへん多いのです。 #3 たとえば，寄生虫の回虫が線虫の仲間です。 #4 また，松枯れ病の原因である松食い虫に寄生するマツノザイセンチュウも仲間です。 #5 寄生虫ですから， #6 医学の1分野として古くから興味がもたれて研究されてきました。 #7 また，受精卵の発生が早く再現性が高いこと，細胞数が少ないことなどから，発生観察の材料として19世紀にはすでに研究されています。 #8 たとえば，ウマカイチュウの卵の研究から，生殖系の細胞と体細胞系の細胞との区別が発生初期に起きることや，体細胞系の細胞で染色体削減が見られることなど，発生学の古典的な研究が行なわれました。 #9 しかしその後，実験発生学は両生類を使って発展し， #10 遺伝学はショウジョウバエを使って発展したため， #11 生物学の材料として線虫は忘れられた存在になってしまいました。 #12 移植実験や再生実験ができなかったことや，その当時，線虫は寄生性のものが使われていたため， #13 遺伝解析には向かなかったからです。,#11,生物学の材料として線虫は忘れられた存在になってしまいました。,#13,遺伝解析には向かなかったからです。,explicit,原因・理由  
26,#1 では，線虫というのは，いったいどんな生物なのでしょうか。 #2 線虫の種類はたいへん多いのです。 #3 たとえば，寄生虫の回虫が線虫の仲間です。 #4 また，松枯れ病の原因である松食い虫に寄生するマツノザイセンチュウも仲間です。 #5 寄生虫ですから， #6 医学の1分野として古くから興味がもたれて研究されてきました。 #7 また，受精卵の発生が早く再現性が高いこと，細胞数が少ないことなどから，発生観察の材料として19世紀にはすでに研究されています。 #8 たとえば，ウマカイチュウの卵の研究から，生殖系の細胞と体細胞系の細胞との区別が発生初期に起きることや，体細胞系の細胞で染色体削減が見られることなど，発生学の古典的な研究が行なわれました。 #9 しかしその後，実験発生学は両生類を使って発展し， #10 遺伝学はショウジョウバエを使って発展したため， #11 生物学の材料として線虫は忘れられた存在になってしまいました。 #12 移植実験や再生実験ができなかったことや，その当時，線虫は寄生性のものが使われていたため， #13 遺伝解析には向かなかったからです。,#12,移植実験や再生実験ができなかったことや，その当時，線虫は寄生性のものが使われていたため，,#13,遺伝解析には向かなかったからです。,explicit,原因・理由  
30,#1 問題のC. elegans は，長さ約1mmの糸ミミズのような線虫です。 #2 正式には Caenorhabditis elegans（シノラブダイティス・エレガンスと読みます）といいます。 #3 土の中で細菌を主食とする非寄生性の線虫で，世界中の土の中で見つかります。 #4 もともとは1900年にアルジェリアで採集されましたが， #5 1946年にイギリスのブルストルで同じ種が採集されたため， #6 ブリストル株N2と名づけられました。 #7 先駆者たちによって実験室での飼育条件や生活史が明らかにされ， #8 さらに生殖系の発生や配偶子形成の研究が進められました。 #9 土の中ですから， #10 生育温度は13〜25℃です。 #11 10℃ぐらいまでは生きていますが， #12 4℃では死んでしまいます。 #13 また逆に，25℃を超すと #14 生きが悪くなり， #15 死んでしまいます（この点が日本で扱う場合の問題点です。）,#5,1946年にイギリスのブルストルで同じ種が採集されたため，,#6,ブリストル株N2と名づけられました。,explicit,原因・理由  
30,#1 問題のC. elegans は，長さ約1mmの糸ミミズのような線虫です。 #2 正式には Caenorhabditis elegans（シノラブダイティス・エレガンスと読みます）といいます。 #3 土の中で細菌を主食とする非寄生性の線虫で，世界中の土の中で見つかります。 #4 もともとは1900年にアルジェリアで採集されましたが， #5 1946年にイギリスのブルストルで同じ種が採集されたため， #6 ブリストル株N2と名づけられました。 #7 先駆者たちによって実験室での飼育条件や生活史が明らかにされ， #8 さらに生殖系の発生や配偶子形成の研究が進められました。 #9 土の中ですから， #10 生育温度は13〜25℃です。 #11 10℃ぐらいまでは生きていますが， #12 4℃では死んでしまいます。 #13 また逆に，25℃を超すと #14 生きが悪くなり， #15 死んでしまいます（この点が日本で扱う場合の問題点です。）,#9,土の中ですから，,#10,生育温度は13〜25℃です。,explicit,原因・理由  
30,#1 問題のC. elegans は，長さ約1mmの糸ミミズのような線虫です。 #2 正式には Caenorhabditis elegans（シノラブダイティス・エレガンスと読みます）といいます。 #3 土の中で細菌を主食とする非寄生性の線虫で，世界中の土の中で見つかります。 #4 もともとは1900年にアルジェリアで採集されましたが， #5 1946年にイギリスのブルストルで同じ種が採集されたため， #6 ブリストル株N2と名づけられました。 #7 先駆者たちによって実験室での飼育条件や生活史が明らかにされ， #8 さらに生殖系の発生や配偶子形成の研究が進められました。 #9 土の中ですから， #10 生育温度は13〜25℃です。 #11 10℃ぐらいまでは生きていますが， #12 4℃では死んでしまいます。 #13 また逆に，25℃を超すと #14 生きが悪くなり， #15 死んでしまいます（この点が日本で扱う場合の問題点です。）,#13,また逆に，25℃を超すと,#14,生きが悪くなり，,explicit,原因・理由  
30,#1 問題のC. elegans は，長さ約1mmの糸ミミズのような線虫です。 #2 正式には Caenorhabditis elegans（シノラブダイティス・エレガンスと読みます）といいます。 #3 土の中で細菌を主食とする非寄生性の線虫で，世界中の土の中で見つかります。 #4 もともとは1900年にアルジェリアで採集されましたが， #5 1946年にイギリスのブルストルで同じ種が採集されたため， #6 ブリストル株N2と名づけられました。 #7 先駆者たちによって実験室での飼育条件や生活史が明らかにされ， #8 さらに生殖系の発生や配偶子形成の研究が進められました。 #9 土の中ですから， #10 生育温度は13〜25℃です。 #11 10℃ぐらいまでは生きていますが， #12 4℃では死んでしまいます。 #13 また逆に，25℃を超すと #14 生きが悪くなり， #15 死んでしまいます（この点が日本で扱う場合の問題点です。）,#13,また逆に，25℃を超すと,#15,死んでしまいます,explicit,原因・理由  
32,#1 おもしろいことに，C. elegans はふつう雌雄同体です。 #2 前後2対の生殖腺では，まず精子がつくられたあと， #3 卵子形成に切り替わります。 #4 成熟した卵子が貯精嚢を通過するときに受精が起こります。 #5 自家受精なのです。 #6 受精卵は子宮の中で途中まで発生し， #7 適宜，からだの中央にある陰門から産み出されます。 #8 受精卵は固い殻をかぶっていますので， #9 親の体外で発生を続け， #10 14時間ぐらいで殻を破って #11 幼虫が孵化します。 #12 その後，4回の脱皮をくり返し， #13 受精から数えて #14 3日半で成虫になるのです。 #15 卵子は栄養があるかぎり #16 次々につくられますが， #17 精子は最初につくられただけ（約300個）です。 #18 これを使い切ると， #19 もう子はできません。 #20 しかし，うまくできたもので， #21 ごく希ですが #22 （0.1％くらいの頻度で）雄もいるのです。 #23 雄は，雌雄同体よりもすこし小柄で #24 長細く，尾の部分が交尾用に特別な構造になっています。 #25 当然のことながら精子のみをつくって， #26 尾の部分で雌雄同体の陰門を探り #27 当てて #28 精子を注入するのです。 #29 このとき， #30 不思議なことですが， #31 雄由来の精子が優先的に受精に使用されます。 #32 理由はわかっていません。 #33 このように，自家受精と他家受精の両方があることは，繁殖と進化の両方に都合のよい戦略だと思われますが， #34 4章で述べられるように2倍体の生物の遺伝解析にとても有利なのです。,#8,受精卵は固い殻をかぶっていますので，,#9,親の体外で発生を続け，,explicit,原因・理由  
