index,orig,reasonIndex,reason,resultIndex,result,category1,category2
341,#1 耐性幼虫は、正常状態の線虫とはかなりちがった特徴をもっています。 #2 体型は正常な虫に比べて細く，喉頭のポンプの動きや活動が鈍くなっています。 #3 耐性幼虫が正常の幼虫に比べて細いのは，特異的な脱皮によってからだ全体が円筒形の中心軸に向かって縮まっているためで， #4 当然，密度も高くなっています。 #5 このため， #6 表皮全体の容積は少なくなりますが， #7 いちばん外側のクチクラ層は相対的に厚くなっています。,#3,耐性幼虫が正常の幼虫に比べて細いのは，特異的な脱皮によってからだ全体が円筒形の中心軸に向かって縮まっているためで，,#4,当然，密度も高くなっています。,explicit,原因・理由  
342,#1 このクチクラは，正常な虫とは異なる特有なものです。 #2 さらに，これが口までも被ってしまうために， #3 虫全体が外部から遮断された状態になり， #4 界面活性剤のような薬剤に対して #5 耐性をもつようになります。 #6 たとえば，1％のドデシル硫酸ナトリウムの中では，正常発生した幼虫は数分で， #7 成虫でも10分以内に死亡して #8 内部が溶け， #9 外側のクチクラだけが残った状態になってしまうのですが， #10 耐性幼虫は長時間生き続けることができます。,#2,さらに，これが口までも被ってしまうために，,#3,虫全体が外部から遮断された状態になり，,explicit,原因・理由  
342,#1 このクチクラは，正常な虫とは異なる特有なものです。 #2 さらに，これが口までも被ってしまうために， #3 虫全体が外部から遮断された状態になり， #4 界面活性剤のような薬剤に対して #5 耐性をもつようになります。 #6 たとえば，1％のドデシル硫酸ナトリウムの中では，正常発生した幼虫は数分で， #7 成虫でも10分以内に死亡して #8 内部が溶け， #9 外側のクチクラだけが残った状態になってしまうのですが， #10 耐性幼虫は長時間生き続けることができます。,#2,さらに，これが口までも被ってしまうために，,#5,耐性をもつようになります。,explicit,目的  
342,#1 このクチクラは，正常な虫とは異なる特有なものです。 #2 さらに，これが口までも被ってしまうために， #3 虫全体が外部から遮断された状態になり， #4 界面活性剤のような薬剤に対して #5 耐性をもつようになります。 #6 たとえば，1％のドデシル硫酸ナトリウムの中では，正常発生した幼虫は数分で， #7 成虫でも10分以内に死亡して #8 内部が溶け， #9 外側のクチクラだけが残った状態になってしまうのですが， #10 耐性幼虫は長時間生き続けることができます。,#4,界面活性剤のような薬剤に対して,#5,耐性をもつようになります。,implicit,原因・理由  
343,#1 動きも独特です。 #2 正常な虫は寒天培地中でその上を這って動きますが， #3 耐性幼虫はふだんの動きは鈍いのですが， #4 時として尾を支えとして立ち上がり， #5 頭を前後にゆらす激しい動きをします。 #6 このため， #7 シャーレを逆さまにしておくと， #8 たくさんの虫が寒天から剥がれ落ちて， #9 ふたに付着しているのが見られます。,#7,シャーレを逆さまにしておくと，,#8,たくさんの虫が寒天から剥がれ落ちて，,explicit,原因・理由  
343,#1 動きも独特です。 #2 正常な虫は寒天培地中でその上を這って動きますが， #3 耐性幼虫はふだんの動きは鈍いのですが， #4 時として尾を支えとして立ち上がり， #5 頭を前後にゆらす激しい動きをします。 #6 このため， #7 シャーレを逆さまにしておくと， #8 たくさんの虫が寒天から剥がれ落ちて， #9 ふたに付着しているのが見られます。,#7,シャーレを逆さまにしておくと，,#9,ふたに付着しているのが見られます。,explicit,原因・理由  
344,#1 ふだん，虫は餌の場所を嗅ぎ分けて #2 そちらに向かう能力があるのですが， #3 耐性幼虫は，餌である細菌に対する化学走化性が失われており， #4 餌に反応しなくなります。 #5 これは，感覚受容器がクチクラで被われてしまうためと思われますが， #6 復帰の過程が開始されることによって感覚受容器が外部に露出するようになるので， #7 再び餌の存在に反応するようになります。 #8 時として見られる耐性幼虫の激しい動きは，餌に対する感覚受容器が役に立たないので， #9 でたらめに動きまわることによって餌を探す出す知恵なのかもしれません。,#6,復帰の過程が開始されることによって感覚受容器が外部に露出するようになるので，,#7,再び餌の存在に反応するようになります。,explicit,原因・理由  
344,#1 ふだん，虫は餌の場所を嗅ぎ分けて #2 そちらに向かう能力があるのですが， #3 耐性幼虫は，餌である細菌に対する化学走化性が失われており， #4 餌に反応しなくなります。 #5 これは，感覚受容器がクチクラで被われてしまうためと思われますが， #6 復帰の過程が開始されることによって感覚受容器が外部に露出するようになるので， #7 再び餌の存在に反応するようになります。 #8 時として見られる耐性幼虫の激しい動きは，餌に対する感覚受容器が役に立たないので， #9 でたらめに動きまわることによって餌を探す出す知恵なのかもしれません。,#8,時として見られる耐性幼虫の激しい動きは，餌に対する感覚受容器が役に立たないので，,#9,でたらめに動きまわることによって餌を探す出す知恵なのかもしれません。,explicit,原因・理由  
344,#1 ふだん，虫は餌の場所を嗅ぎ分けて #2 そちらに向かう能力があるのですが， #3 耐性幼虫は，餌である細菌に対する化学走化性が失われており， #4 餌に反応しなくなります。 #5 これは，感覚受容器がクチクラで被われてしまうためと思われますが， #6 復帰の過程が開始されることによって感覚受容器が外部に露出するようになるので， #7 再び餌の存在に反応するようになります。 #8 時として見られる耐性幼虫の激しい動きは，餌に対する感覚受容器が役に立たないので， #9 でたらめに動きまわることによって餌を探す出す知恵なのかもしれません。,#3,耐性幼虫は，餌である細菌に対する化学走化性が失われており，,#4,餌に反応しなくなります。,implicit,原因・理由  
348,#1 耐性幼虫になってからは，正常な虫の4倍から8倍も長生きすることができます。 #2 豊富な餌が与えられたりして #3 環境条件がよくなってくると， #4 耐性幼虫は脱皮して #5 正常な第4期幼虫（L4）にふっきします。 #6 この耐性幼虫として残るか，あるいは #7 L4に移行にするかの決断は，2つの相反する化学感覚器によって行なわれています。,#3,環境条件がよくなってくると，,#4,耐性幼虫は脱皮して,explicit,原因・理由  
350,#1 線虫のエネルギー代謝を調べてみると， #2 L1のときにはグリオキシル回路の活性が高く，L2以降はクエン酸回路が優先的に使われています。 #3 L1に比べて，L2以降では，ATPや他の高エネルギーリン酸と同じように，クエン酸回路の中ではたらくイソクエン酸デヒドロゲナーゼの活性が上昇しますが， #4 L2dではこの酵素活性や高エネルギーリン酸の上昇が見られず， #5 低いエネルギー状態になります（図3）。 #6 耐性幼虫になる準備のために，L2dのあいだに栄養を腸管細胞に蓄積し， #7 耐性幼虫もこのままの低いエネルギー状態を保ちます。 #8 この低いエネルギー状態になることが，長寿の秘訣かもしれません。 #9 餌を与えると， #10 再び高エネルギー状態に戻ります。,#4,L2dではこの酵素活性や高エネルギーリン酸の上昇が見られず，,#5,低いエネルギー状態になります。,implicit,原因・理由  
352,#1 さてそれでは，線虫は環境の変化にどのように応答して， #2 耐性幼虫に移行したり， #3 正常発生に戻ったりするのでしょうか。 #4 ここには，外部からの刺激を受けてから， #5 その信号を神経回路や信号伝達経路を介して #6 細胞に伝え， #7 形態変化を起こすための多くの遺伝子が関与する複雑な経路が存在しています。 #8 これらの遺伝子や経路を明らかにするには， #9 まず耐性幼虫の形成に異常を示す突然変異体（daf： abnormal dauer formation）を分離して解析する方法があります。 #10 この突然変異体は，耐性幼虫の欠損突然変異体（daf−d： defective）と，構成的突然変異体（daf−c： constitutive）の2つに分けることができます。,#4,ここには，外部からの刺激を受けてから，,#5,その信号を神経回路や信号伝達経路を介して,explicit,原因・理由  
352,#1 さてそれでは，線虫は環境の変化にどのように応答して， #2 耐性幼虫に移行したり， #3 正常発生に戻ったりするのでしょうか。 #4 ここには，外部からの刺激を受けてから， #5 その信号を神経回路や信号伝達経路を介して #6 細胞に伝え， #7 形態変化を起こすための多くの遺伝子が関与する複雑な経路が存在しています。 #8 これらの遺伝子や経路を明らかにするには， #9 まず耐性幼虫の形成に異常を示す突然変異体（daf： abnormal dauer formation）を分離して解析する方法があります。 #10 この突然変異体は，耐性幼虫の欠損突然変異体（daf−d： defective）と，構成的突然変異体（daf−c： constitutive）の2つに分けることができます。,#4,ここには，外部からの刺激を受けてから，,#7,形態変化を起こすための多くの遺伝子が関与する複雑な経路が存在しています。,explicit,原因・理由  
352,#1 さてそれでは，線虫は環境の変化にどのように応答して， #2 耐性幼虫に移行したり， #3 正常発生に戻ったりするのでしょうか。 #4 ここには，外部からの刺激を受けてから， #5 その信号を神経回路や信号伝達経路を介して #6 細胞に伝え， #7 形態変化を起こすための多くの遺伝子が関与する複雑な経路が存在しています。 #8 これらの遺伝子や経路を明らかにするには， #9 まず耐性幼虫の形成に異常を示す突然変異体（daf： abnormal dauer formation）を分離して解析する方法があります。 #10 この突然変異体は，耐性幼虫の欠損突然変異体（daf−d： defective）と，構成的突然変異体（daf−c： constitutive）の2つに分けることができます。,#8,これらの遺伝子や経路を明らかにするには，,#9,まず耐性幼虫の形成に異常を示す突然変異体を分離して解析する方法があります。,explicit,目的  
353,#1 daf−d は，耐性幼虫になることができない突然変異体です。 #2 このような daf−d の約半分は，化学走化性や雄との交配，また浸透圧の感知機能などにもかかわっているために， #3 耐性幼虫の形成と化学走化性などの両方に欠損を示すことがあります。 #4 一方，daf−c は，正常発生する状況であっても， #5 耐性幼虫に変化してしまう突然変異体です。 #6 一般に温度感受性株として分離されますが， #7 ある温度条件下で，正常状態ではあり #8 えない，耐性幼虫の形成を招くまちがった信号が出てしまうためです。,#2,このような daf−d の約半分は，化学走化性や雄との交配，また浸透圧の感知機能などにもかかわっているために，,#3,耐性幼虫の形成と化学走化性などの両方に欠損を示すことがあります。,explicit,目的  
353,#1 daf−d は，耐性幼虫になることができない突然変異体です。 #2 このような daf−d の約半分は，化学走化性や雄との交配，また浸透圧の感知機能などにもかかわっているために， #3 耐性幼虫の形成と化学走化性などの両方に欠損を示すことがあります。 #4 一方，daf−c は，正常発生する状況であっても， #5 耐性幼虫に変化してしまう突然変異体です。 #6 一般に温度感受性株として分離されますが， #7 ある温度条件下で，正常状態ではあり #8 えない，耐性幼虫の形成を招くまちがった信号が出てしまうためです。,#7,ある温度条件下で，正常状態ではあり,#8,えない，耐性幼虫の形成を招くまちがった信号が出てしまうためです。,explicit,原因・理由  
354,#1 この daf−d と daf−c の二重突然変異体をつくり， #2 どちらの表現型が優位になるかを調べます。 #3 たとえば，1つの経路の中では下流にある遺伝子のほうが耐性幼虫の形成の決定権をもつので， #4 二重突然変異体が耐性幼虫にならないとすると， #5 経路を遮断する daf−d が daf−c の下流にあると考えられます。 #6 一方，これが耐性幼虫になるとすると， #7 daf−c が下流にあると考えられます。 #8 これは上流に関係なく，耐性幼虫になる信号が出てしまうためです。,#3,たとえば，1つの経路の中では下流にある遺伝子のほうが耐性幼虫の形成の決定権をもつので，,#5,経路を遮断する daf−d が daf−c の下流にあると考えられます。,explicit,原因・理由  
360,#1 摂食や産卵のために活発に動きまわっていた虫も，産まれてから #2 10日を過ぎるあたりから徐々に動きが鈍くなり， #3 老齢期に入ってきます。 #4 虫の内部を観察してみると， #5 細胞内にはリポフスチンとよばれる顆粒が蓄積し， #6 透明だった虫が褐色化してきます。 #7 また，若いころにははっきりとしていた細胞や組織の境目が不明瞭になってきたり， #8 ところどころ死んだ細胞が消失した部分に水泡も見えるようになってきます（図1）。 #9 それでもまだ，針先などで頭や体を刺激してやれば， #10 一時的ですが #11 動くようになります。 #12 さらに日が経つと， #13 それも頭を少し動かす程度になり， #14 やがてまったく反応を示さなくなり #15 死を迎えます。 #16 死んだ虫の多くは，内部の細胞が自己消化をおこして透明になるので， #17 外側のクチクラ層だけが残った状態になり， #18 生きている虫とはすぐに見分けがつきます。,#1,摂食や産卵のために活発に動きまわっていた虫も，産まれてから,#2,10日を過ぎるあたりから徐々に動きが鈍くなり，,explicit,原因・理由  
360,#1 摂食や産卵のために活発に動きまわっていた虫も，産まれてから #2 10日を過ぎるあたりから徐々に動きが鈍くなり， #3 老齢期に入ってきます。 #4 虫の内部を観察してみると， #5 細胞内にはリポフスチンとよばれる顆粒が蓄積し， #6 透明だった虫が褐色化してきます。 #7 また，若いころにははっきりとしていた細胞や組織の境目が不明瞭になってきたり， #8 ところどころ死んだ細胞が消失した部分に水泡も見えるようになってきます（図1）。 #9 それでもまだ，針先などで頭や体を刺激してやれば， #10 一時的ですが #11 動くようになります。 #12 さらに日が経つと， #13 それも頭を少し動かす程度になり， #14 やがてまったく反応を示さなくなり #15 死を迎えます。 #16 死んだ虫の多くは，内部の細胞が自己消化をおこして透明になるので， #17 外側のクチクラ層だけが残った状態になり， #18 生きている虫とはすぐに見分けがつきます。,#16,死んだ虫の多くは，内部の細胞が自己消化をおこして透明になるので，,#17,外側のクチクラ層だけが残った状態になり，,explicit,原因・理由  
360,#1 摂食や産卵のために活発に動きまわっていた虫も，産まれてから #2 10日を過ぎるあたりから徐々に動きが鈍くなり， #3 老齢期に入ってきます。 #4 虫の内部を観察してみると， #5 細胞内にはリポフスチンとよばれる顆粒が蓄積し， #6 透明だった虫が褐色化してきます。 #7 また，若いころにははっきりとしていた細胞や組織の境目が不明瞭になってきたり， #8 ところどころ死んだ細胞が消失した部分に水泡も見えるようになってきます（図1）。 #9 それでもまだ，針先などで頭や体を刺激してやれば， #10 一時的ですが #11 動くようになります。 #12 さらに日が経つと， #13 それも頭を少し動かす程度になり， #14 やがてまったく反応を示さなくなり #15 死を迎えます。 #16 死んだ虫の多くは，内部の細胞が自己消化をおこして透明になるので， #17 外側のクチクラ層だけが残った状態になり， #18 生きている虫とはすぐに見分けがつきます。,#16,死んだ虫の多くは，内部の細胞が自己消化をおこして透明になるので，,#18,生きている虫とはすぐに見分けがつきます。,explicit,原因・理由  
361,#1 野生体の寿命曲線を作成してみると， #2 早い虫では10日目くらいから死にはじめ， #3 最長寿命が約25日のきれいなシグモイド曲線になります。 #4 この最長寿命の長さが老化や寿命の研究に適しており， #5 取り扱いやすさと相まって， #6 線虫が多くの研究者によってさかんに使われるようになりました。,#5,取り扱いやすさと相まって，,#6,線虫が多くの研究者によってさかんに使われるようになりました。,implicit,原因・理由  
362,#1 老化は，現象が広範囲に現われ， #2 原因と結果が混沌としているために #3 因果関係がはっきりせず， #4 そのため #5 その機構はいまだに謎に包まれています。 #6 しかし最近，その謎を解く鍵がいくつか #7 見つかってきました。 #8 たとえば寿命に関していえば， #9 それぞれの動物は種固有の寿命をもっていて， #10 それは寿命が遺伝子の支配を大きく受けていると #11 考えらえれます。 #12 最近になって， #13 この遺伝子を分離することが可能になってきました。 #14 そして環境もまた，寿命を大きく変化させることも確かなようで， #15 この環境要因も徐々にわかってきました。,#2,原因と結果が混沌としているために,#3,因果関係がはっきりせず，,explicit,原因・理由  
362,#1 老化は，現象が広範囲に現われ， #2 原因と結果が混沌としているために #3 因果関係がはっきりせず， #4 そのため #5 その機構はいまだに謎に包まれています。 #6 しかし最近，その謎を解く鍵がいくつか #7 見つかってきました。 #8 たとえば寿命に関していえば， #9 それぞれの動物は種固有の寿命をもっていて， #10 それは寿命が遺伝子の支配を大きく受けていると #11 考えらえれます。 #12 最近になって， #13 この遺伝子を分離することが可能になってきました。 #14 そして環境もまた，寿命を大きく変化させることも確かなようで， #15 この環境要因も徐々にわかってきました。,#10,それは寿命が遺伝子の支配を大きく受けていると,#11,考えらえれます。,explicit,原因・理由  
362,#1 老化は，現象が広範囲に現われ， #2 原因と結果が混沌としているために #3 因果関係がはっきりせず， #4 そのため #5 その機構はいまだに謎に包まれています。 #6 しかし最近，その謎を解く鍵がいくつか #7 見つかってきました。 #8 たとえば寿命に関していえば， #9 それぞれの動物は種固有の寿命をもっていて， #10 それは寿命が遺伝子の支配を大きく受けていると #11 考えらえれます。 #12 最近になって， #13 この遺伝子を分離することが可能になってきました。 #14 そして環境もまた，寿命を大きく変化させることも確かなようで， #15 この環境要因も徐々にわかってきました。,#14,そして環境もまた，寿命を大きく変化させることも確かなようで，,#15,この環境要因も徐々にわかってきました。,implicit,原因・理由  
365,#1 まず，線虫（C. elegans）の遺伝的に均一な野生体の寿命を測定してみました。 #2 そして次に，このなかでさまざまな時期に死亡した虫の子孫の寿命を測定してみました。 #3 その結果， #4 親虫がどのような寿命であっても， #5 そこから産まれた子孫の寿命曲線は親と同じになりました。 #6 これは，最大寿命に達しなかった虫の死は偶発的なもの，つまり環境によるものであって， #7 遺伝的なものではないことを示しています。 #8 個々の虫の寿命は，細胞中につねに生じている傷が，その個体の生存に致命的になることで決められているのかもしれません。,#4,親虫がどのような寿命であっても，,#5,そこから産まれた子孫の寿命曲線は親と同じになりました。,explicit,原因・理由  
366,#1 次に寿命が同じなのですが， #2 遺伝的背景がちがう2種類の野生体を交配してみると， #3 その孫には親よりも長い寿命をもつものや，短い寿命をもつものが現われました。 #4 これは，2つのちがった野生体がもつ寿命にかかわる遺伝子が，いろいろな組合せではたらくためと考えられています。 #5 これらの子孫を別々に自家受精で17代飼育を続け， #6 その寿命を測定してみました。 #7 もし環境が原因であるとするならば， #8 孫の代で長い寿命や短い寿命をもつことは偶然で， #9 その形質は17代目の虫までは受け継がれないはずです。 #10 結果は，長い寿命を示した虫の子孫の寿命はやはり長く，逆に短い寿命の虫の子孫は短い傾向を示しました。 #11 これは，寿命の長さが遺伝的に受け継がれたことを示しています。 #12 この実験から線虫の寿命は，30〜50％が遺伝的な支配によって，残りが環境によって決められていることがわかりました（図2）。,#2,遺伝的背景がちがう2種類の野生体を交配してみると，,#3,その孫には親よりも長い寿命をもつものや，短い寿命をもつものが現われました。,explicit,原因・理由  
367,#1 進化論者のなかには，老化の拮抗的な多面発現という説を唱える人がいます。 #2 これは，たとえば，ある遺伝子が産卵数と寿命決定に正反対の影響を及ぼすものとすれば， #3 たとえ寿命が短くなっても #4 産卵数を増加させる能力のある遺伝子を好んで使うであろうという説です。 #5 つまり，生物は寿命の短縮という犠牲を払っても， #6 発生の期間を短縮させたり #7 産卵数を増やしたりして， #8 種の保存のために有利になるようにはたらく遺伝子を優先的に使うというものです。 #9 この説は，産卵によるエネルギーの消耗が寿命の短縮をひき起こすと考えると， #10 わかりやすいと思います。 #11 しかし，前に示した2つの野生体をかけ合わせて出現した，いろいろな寿命をもつ子孫を使って， #12 寿命と産卵数を調べてみたかぎりでは，両者にはっきりした因果関係は認められませんでした（図3）。,#9,この説は，産卵によるエネルギーの消耗が寿命の短縮をひき起こすと考えると，,#10,わかりやすいと思います。,explicit,原因・理由  
