index,orig,reasonIndex,reason,resultIndex,result,category1,category2
235,#1 C. elegans の生殖細胞では，減数分裂のときにMAPキナーゼ経路がはたらいていることが知られています。 #2 他の多くの細胞でも，それぞれなんらかの役割をはたしているものと思われます。 #3 しかし，MAPキナーゼカスケードにはいろいろな変形があります。 #4 Rasタンパク質よりも上流の細胞外からの信号の受容と伝達， #5 MAPキナーゼよりも下流では，とくに変形が目立ちます。 #6 また，主要なMAPキナーゼカスケードについても，Rasタンパク質，MAPキナーゼ，MAPキナーゼキナーゼなどの因子が複数あり， #7 カスケードがいくつか #8 あったり， #9 枝分かれしていたりします。 #10 つまり，実際は1本道の信号伝達カスケードではなく， #11 いろいろな経路のネットワークとしてはたらいていると考えてください。 #12 このような普遍的な因子や信号伝達カスケードが線虫でも見つかったことは，それだけで重要なことですが， #13 それ以上に，線虫が細胞分化や信号伝達の分子レベルの解析にとても役立つことを示しています。,#12,このような普遍的な因子や信号伝達カスケードが線虫でも見つかったことは，それだけで重要なことですが，,#13,それ以上に，線虫が細胞分化や信号伝達の分子レベルの解析にとても役立つことを示しています。,implicit,原因・理由  
237,#1 図3に示した信号伝達因子の遺伝子のなかで，私たちは let−23 をクローン化しました。 #2 その結果， #3 これがEGF受容体に似たチロシンキナーゼをコードする遺伝子であることが明らかになりました。 #4 let−23遺伝子がどの細胞で発現しているかは，技術的に困難であるため #5 解明できませんでした。 #6 おそらく，陰門前駆細胞やその付近の神経細胞を含む多くの細胞で発現していると推定されます。,#4,let−23遺伝子がどの細胞で発現しているかは，技術的に困難であるため,#5,解明できませんでした。,explicit,原因・理由  
240,#1 遺伝モザイクとは，この場合， #2 let−23＋ncl−1＋ の細胞と， let−23−ncl−1− の細胞とを，両方もつ個体を指します。 #3 染色体上の遺伝子が let−23−ncl−1− で，染色体外に let−23＋ と ncl−1＋ の遺伝子の共重合体をもつ生殖細胞から生まれた個体は，染色体外の遺伝子の共重合体が完全に安定ではなく， #4 細胞分裂のときに失われることもあるため， #5 このようなモザイク個体が生じるのです。 #6 共重合体をもっていれば let−23＋ncl−1＋，共重合体をもたなければ let−23−ncl−1− になります（図4a）。 #7 このようなモザイク個体には，染色体外の遺伝子がどの細胞系譜のどの時点で失われたかによって，さまざまなものがあります。 #8 そして，各細胞の ncl−1 遺伝子の遺伝子型は，その細胞の核の中の核小体の大きさを顕微鏡で観察して判定します。 #9 核小体は，ncl−1−1 が ncl−1＋ よりも大きいのです。 #10 ncl−1−1 であれば， #11 let−23 遺伝子も let−23− のはずです。,#4,細胞分裂のときに失われることもあるため，,#5,このようなモザイク個体が生じるのです。,explicit,原因・理由  
241,#1 多くのモザイク個体について，このようにして #2 各細胞系譜のlet−23遺伝子型を判定し，また， #3 それが正常な陰門をつくるかどうかを観察します（図4b）。 #4 この結果から，陰門を形成するためには， #5 野生型のlet−23遺伝子が，陰門前駆細胞をつくるABp細胞系譜で必要なことがわかりました。 #6 ABp細胞系譜をさらに詳細に解析した結果， #7 先に述べたように，1°の陰門の運命をとる陰門前駆細胞でだけ，野生型の遺伝子が機能すればよいことがわかったわけです。,#4,この結果から，陰門を形成するためには，,#5,野生型のlet−23遺伝子が，陰門前駆細胞をつくるABp細胞系譜で必要なことがわかりました。,explicit,目的  
242,#1 遺伝モザイクではない通常の C. elegans では，おそらく，2°の陰門の運命をとる陰門前駆細胞でもlet−23遺伝子がはたらいています。 #2 そして，1°になる陰門前駆細胞よりも，2°になる陰門前駆細胞のほうが錨細胞から遠いため， #3 錨細胞からの誘導信号の量（図2上の点線）が少なく，その場合， #4 1°ではなく2°の運命に導く機構がはたらく可能性があります。 #5 その場合も，図3のRasタンパク質からMAPキナーゼまでのカスケードが，信号伝達に使われるものと考えられます。 #6 図3に示したLET−23タンパク質以外の因子のなかで， #7 LIN−3タンパク質は錨細胞で， #8 LIN−12タンパク質は陰門前駆細胞と鎖細胞前駆体で， #9 それぞれはたらくことがわかっています。 #10 しかし，その他の因子が発現したり #11 機能したりする細胞は明らかにされていません。,#2,そして，1°になる陰門前駆細胞よりも，2°になる陰門前駆細胞のほうが錨細胞から遠いため，,#3,錨細胞からの誘導信号の量が少なく，その場合，,explicit,原因・理由  
242,#1 遺伝モザイクではない通常の C. elegans では，おそらく，2°の陰門の運命をとる陰門前駆細胞でもlet−23遺伝子がはたらいています。 #2 そして，1°になる陰門前駆細胞よりも，2°になる陰門前駆細胞のほうが錨細胞から遠いため， #3 錨細胞からの誘導信号の量（図2上の点線）が少なく，その場合， #4 1°ではなく2°の運命に導く機構がはたらく可能性があります。 #5 その場合も，図3のRasタンパク質からMAPキナーゼまでのカスケードが，信号伝達に使われるものと考えられます。 #6 図3に示したLET−23タンパク質以外の因子のなかで， #7 LIN−3タンパク質は錨細胞で， #8 LIN−12タンパク質は陰門前駆細胞と鎖細胞前駆体で， #9 それぞれはたらくことがわかっています。 #10 しかし，その他の因子が発現したり #11 機能したりする細胞は明らかにされていません。,#2,そして，1°になる陰門前駆細胞よりも，2°になる陰門前駆細胞のほうが錨細胞から遠いため，,#4,1°ではなく2°の運命に導く機構がはたらく可能性があります。,explicit,原因・理由  
247,#1 次に，lin−15遺伝子について述べましょう。 #2 この遺伝子と産物の構造は最近明らかになったばかりです。 #3 注目すべきことに，lin−15遺伝子の転写から1つのmRNA前駆体がつくられ， #4 それから2つの mRNA，したがって，2つのタンパク質がつくられます。 #5 lin−15遺伝子は真核生物には珍しく（線虫ではしばしば見つかりますが），ポリシストロニックな RNA をコードしているオペロンなのです。 #6 これら2つのタンパク質は，いずれも既知の他のタンパク質とは相同性がなく，まだその分子レベルの機能は不明です。 #7 これら2つのタンパク質がともにできなくなるようなlin−15遺伝子の突然変異体では，余計な陰門に似た構造ができてしまう，陰門形成の異常（Muv，図1b山椒）を示します。 #8 そして，これらのことから，Lin−15タンパク質は，図2に示した下皮多核細胞（hyp7）からの陰門形成の抑制信号に関与していると考えられます。 #9 この抑制信号は，図3に示したMAPキナーゼカスケードを含む信号伝達経路と，どこかで関係する可能性があります。,#3,注目すべきことに，lin−15遺伝子の転写から1つのmRNA前駆体がつくられ，,#4,それから2つの mRNA，したがって，2つのタンパク質がつくられます。,explicit,原因・理由  
251,#1 線虫の大多数の種は，ヒトや哺乳動物と同じく雄と雌の2性ですが， #2 C. elegans という種はたいへんユニークで， #3 雌雄同体と雄の2性です。 #4 雌雄同体は卵子と精子の両方をつくって #5 体内受精を行なうので， #6 雄なしで子孫をつくることができます。 #7 それだけでなく，雄と交尾することもできます。 #8 この場合， #9 ふしぎなことに，雄からの精子が優先して #10 受精に使われ， #11 交雑による子孫をつくります。 #12 しっかり子孫をふやしながら，適宜，遺伝形質を交換するという高等戦術に思えます。 #13 また見方を変えれば， #14 遺伝解析を行なうために #15 線虫がいるようにも思えます。,#5,体内受精を行なうので，,#6,雄なしで子孫をつくることができます。,explicit,原因・理由  
251,#1 線虫の大多数の種は，ヒトや哺乳動物と同じく雄と雌の2性ですが， #2 C. elegans という種はたいへんユニークで， #3 雌雄同体と雄の2性です。 #4 雌雄同体は卵子と精子の両方をつくって #5 体内受精を行なうので， #6 雄なしで子孫をつくることができます。 #7 それだけでなく，雄と交尾することもできます。 #8 この場合， #9 ふしぎなことに，雄からの精子が優先して #10 受精に使われ， #11 交雑による子孫をつくります。 #12 しっかり子孫をふやしながら，適宜，遺伝形質を交換するという高等戦術に思えます。 #13 また見方を変えれば， #14 遺伝解析を行なうために #15 線虫がいるようにも思えます。,#14,遺伝解析を行なうために,#15,線虫がいるようにも思えます。,explicit,目的  
252,#1 それはともかく，この2性のちがいはX染色体の本数で決まります。 #2 2本のX染色体（XX）をもつのが雌雄同体，1本の場合（XO と書きます）が雄になります。 #3 雄は，減数分裂時にX染色体の不分離が起こって， #4 X染色体を失った結果です。 #5 通常は，雄は全体の0.3％程度で， #6 大部分は雌雄同体です。 #7 このようにして決まった受精卵でのX染色体と常染色体との比が最初の引き金となって， #8 それぞれの遺伝子がドミノ倒しのように発現して #9 く結果，別々の形をつくるのです。 #10 自然のホメオティック変異（転移？）といってもよいでしょう。 #11 この場合も，性転換の変異体は生存には影響ありませんので， #12 古くからたくさんの変異体がとられてきました。 #13 これをもとに，性決定の遺伝子経路が明らかにされてきたのです。,#11,この場合も，性転換の変異体は生存には影響ありませんので，,#12,古くからたくさんの変異体がとられてきました。,explicit,原因・理由  
262,#1 常染色体のゲノムの一組をAとしますと， #2 雌雄同体は AAXX，雄は AAXO（あるいは AAX）となります。 #3 AAXXX は雌雄同体，AAAXX は雄，AAAAXX は雄，AAAAXXX（X）は雌雄同体となることから， #4 X染色体と常染色体の比（X／A比）が，性決定の基となる信号と考えられます。 #5 この比と xol−1 のあいだの遺伝子のカスケードはわかっていません。 #6 また，tra−1 の下流には多くの遺伝子が関与すると思われます。 #7 そのなかには，egl−5，mab−3，fog−1，fog−2 などがあり， #8 mab−3 と fog−1 の転写をTRA−1Aタンパク質が調節している可能性が考えられています。 #9 ここにあげた遺伝子のなかで，xol−1，sdc−1，sdc−2，sdc−3，fox−1 はX染色体上にありますが， #10 他の遺伝子は常染色体上にあることが注目されます。,#3,AAXXX は雌雄同体，AAAXX は雄，AAAAXX は雄，AAAAXXXは雌雄同体となることから，,#4,X染色体と常染色体の比が，性決定の基となる信号と考えられます。,implicit,原因・理由  
268,#1 注意深い観察から，このプログラム細胞死が起こらなくなる変異体が分離されてきました。 #2 この場合も変異体は生存が可?能だったので， #3 その遺伝子カスケードが明らかにされました。 #4 ただ，よく考えてみると， #5 そもそも2倍になったあとで片方の細胞が死ぬのですから， #6 細胞の数はふえません。 #7 また，死ななくても #8 影響がないとしたら， #9 いったい細胞死は何の役に立っているのでしょうか。 #10 細胞質因子を不均等に娘細胞に分配することによって新しい性質の細胞をつくりだすという考えや，染色体の構造を変えるために #11 1回複製することがだいじという考えもありますが， #12 残念ながらほんとうの意味はわかっていません。 #13 それは今後の研究に待たなければなりません。 #14 しかし，プログラム細胞死の遺伝子カスケードがもっともよくわかってきたのは線虫ですし， #15 しかも以下に述べるように，その機構がヒトなど哺乳動物におけるアポトーシスと同じであることがわかり， #16 一躍注目をあびているわけです。,#2,この場合も変異体は生存が可能だったので，,#3,その遺伝子カスケードが明らかにされました。,explicit,原因・理由  
268,#1 注意深い観察から，このプログラム細胞死が起こらなくなる変異体が分離されてきました。 #2 この場合も変異体は生存が可?能だったので， #3 その遺伝子カスケードが明らかにされました。 #4 ただ，よく考えてみると， #5 そもそも2倍になったあとで片方の細胞が死ぬのですから， #6 細胞の数はふえません。 #7 また，死ななくても #8 影響がないとしたら， #9 いったい細胞死は何の役に立っているのでしょうか。 #10 細胞質因子を不均等に娘細胞に分配することによって新しい性質の細胞をつくりだすという考えや，染色体の構造を変えるために #11 1回複製することがだいじという考えもありますが， #12 残念ながらほんとうの意味はわかっていません。 #13 それは今後の研究に待たなければなりません。 #14 しかし，プログラム細胞死の遺伝子カスケードがもっともよくわかってきたのは線虫ですし， #15 しかも以下に述べるように，その機構がヒトなど哺乳動物におけるアポトーシスと同じであることがわかり， #16 一躍注目をあびているわけです。,#5,そもそも2倍になったあとで片方の細胞が死ぬのですから，,#6,細胞の数はふえません。,explicit,原因・理由  
268,#1 注意深い観察から，このプログラム細胞死が起こらなくなる変異体が分離されてきました。 #2 この場合も変異体は生存が可?能だったので， #3 その遺伝子カスケードが明らかにされました。 #4 ただ，よく考えてみると， #5 そもそも2倍になったあとで片方の細胞が死ぬのですから， #6 細胞の数はふえません。 #7 また，死ななくても #8 影響がないとしたら， #9 いったい細胞死は何の役に立っているのでしょうか。 #10 細胞質因子を不均等に娘細胞に分配することによって新しい性質の細胞をつくりだすという考えや，染色体の構造を変えるために #11 1回複製することがだいじという考えもありますが， #12 残念ながらほんとうの意味はわかっていません。 #13 それは今後の研究に待たなければなりません。 #14 しかし，プログラム細胞死の遺伝子カスケードがもっともよくわかってきたのは線虫ですし， #15 しかも以下に述べるように，その機構がヒトなど哺乳動物におけるアポトーシスと同じであることがわかり， #16 一躍注目をあびているわけです。,#10,細胞質因子を不均等に娘細胞に分配することによって新しい性質の細胞をつくりだすという考えや，染色体の構造を変えるために,#11,1回複製することがだいじという考えもありますが，,explicit,目的  
268,#1 注意深い観察から，このプログラム細胞死が起こらなくなる変異体が分離されてきました。 #2 この場合も変異体は生存が可?能だったので， #3 その遺伝子カスケードが明らかにされました。 #4 ただ，よく考えてみると， #5 そもそも2倍になったあとで片方の細胞が死ぬのですから， #6 細胞の数はふえません。 #7 また，死ななくても #8 影響がないとしたら， #9 いったい細胞死は何の役に立っているのでしょうか。 #10 細胞質因子を不均等に娘細胞に分配することによって新しい性質の細胞をつくりだすという考えや，染色体の構造を変えるために #11 1回複製することがだいじという考えもありますが， #12 残念ながらほんとうの意味はわかっていません。 #13 それは今後の研究に待たなければなりません。 #14 しかし，プログラム細胞死の遺伝子カスケードがもっともよくわかってきたのは線虫ですし， #15 しかも以下に述べるように，その機構がヒトなど哺乳動物におけるアポトーシスと同じであることがわかり， #16 一躍注目をあびているわけです。,#10,細胞質因子を不均等に娘細胞に分配することによって新しい性質の細胞をつくりだすという考えや，染色体の構造を変えるために,#12,残念ながらほんとうの意味はわかっていません。,explicit,原因・理由  
272,#1 ced−9 もたいへん重要で #2 興味ある遺伝子です。 #3 ced−9 遺伝子の機能喪失の突然変異体では，正常では #4 死なない多くの細胞がプログラム細胞死を起こし， #5 胚の発生中に死んでしまいます。 #6 また，ced−9 の機能が増大したと考えられる突然変異体では，プログラム細胞死が起こらなくなります。 #7 したがって，ced−9 は細胞死の調節スイッチとしてはたらいていて， #8 その正常な状態では，131個の細胞死だけが起こるように，ced−3 または ced−4 の活性を抑制していると考えられます。 #9 とても興味深いことに，ced−9遺伝子の産物（280アミノ酸）は，哺乳類で発見され #10 プログラム細胞死（アポトーシス）を阻害すると考えられているBcl−2タンパク質と相同性があることがわかりました。 #11 さらにおどろくべきことに，ced−9とbcl−2遺伝子は，細胞死に関して， #12 たがいに機能を交換しあえることが，遺伝子導入によって確かめられたのです。,#6,また，ced−9 の機能が増大したと考えられる突然変異体では，プログラム細胞死が起こらなくなります。,#7,したがって，ced−9 は細胞死の調節スイッチとしてはたらいていて，,explicit,原因・理由  
272,#1 ced−9 もたいへん重要で #2 興味ある遺伝子です。 #3 ced−9 遺伝子の機能喪失の突然変異体では，正常では #4 死なない多くの細胞がプログラム細胞死を起こし， #5 胚の発生中に死んでしまいます。 #6 また，ced−9 の機能が増大したと考えられる突然変異体では，プログラム細胞死が起こらなくなります。 #7 したがって，ced−9 は細胞死の調節スイッチとしてはたらいていて， #8 その正常な状態では，131個の細胞死だけが起こるように，ced−3 または ced−4 の活性を抑制していると考えられます。 #9 とても興味深いことに，ced−9遺伝子の産物（280アミノ酸）は，哺乳類で発見され #10 プログラム細胞死（アポトーシス）を阻害すると考えられているBcl−2タンパク質と相同性があることがわかりました。 #11 さらにおどろくべきことに，ced−9とbcl−2遺伝子は，細胞死に関して， #12 たがいに機能を交換しあえることが，遺伝子導入によって確かめられたのです。,#11,さらにおどろくべきことに，ced−9とbcl−2遺伝子は，細胞死に関して，,#12,たがいに機能を交換しあえることが，遺伝子導入によって確かめられたのです。,implicit,原因・理由  
274,#1 ced−9 よりも前の，死ぬべき細胞の決定過程は，細胞系譜によって異なるようです。 #2 たとえば，雌雄同体によってHSN神経細胞となる細胞は，雄では細胞死を起こしますが， #3 雌雄同体では egl−1 が細胞死を阻止しているために #4 HSN神経細胞が生き残ると考えられています。 #5 ced−9，ced−3 以外の大部分の遺伝子の機能は不明です。 #6 ced−3遺伝子が他のタンパク質を分解することによって細胞死が起こる可能性はありますが， #7 細胞死の実行の機構の詳細は不明です。 #8 また，他の細胞による取り込みの機構も不明です。,#3,雌雄同体では egl−1 が細胞死を阻止しているために,#4,HSN神経細胞が生き残ると考えられています。,explicit,目的  
278,#1 動物と植物のちがいはなんでしょう。 #2 それは，動物が「動く」ことです。 #3 動きの源は筋肉組織です。 #4 この重要な筋肉の研究には長い歴史があり， #5 それぞれの目的に有利な材料が使われてきました。 #6 筋肉タンパク質の生化学的な性質はおもにウサギを使った実験から調べられてきましたし， #7 電気生理学的な性質はカエルを使った実験が主でした。 #8 しかし，筋肉タンパク質の構造と機能， #9 筋肉の形成機構を調べるには， #10 やはり遺伝学の手法が必要になってきます。 #11 そこで線虫の登場です。 #12 線虫にも立派な筋肉組織があります。 #13 そこに突然変異が入ったものは「動きの悪い」虫として簡単に見つけることができますので， #14 これまでに膨大な数の変異体が分離され #15 調べられてきました。 #16 ここでは，筋肉タンパク質の遺伝子が変異した線虫では，どのようにして #17 筋肉を形成するのか，また #18 筋肉遺伝子がどのように発現制御されるのかを説明します。,#9,筋肉の形成機構を調べるには，,#10,やはり遺伝学の手法が必要になってきます。,explicit,目的  
278,#1 動物と植物のちがいはなんでしょう。 #2 それは，動物が「動く」ことです。 #3 動きの源は筋肉組織です。 #4 この重要な筋肉の研究には長い歴史があり， #5 それぞれの目的に有利な材料が使われてきました。 #6 筋肉タンパク質の生化学的な性質はおもにウサギを使った実験から調べられてきましたし， #7 電気生理学的な性質はカエルを使った実験が主でした。 #8 しかし，筋肉タンパク質の構造と機能， #9 筋肉の形成機構を調べるには， #10 やはり遺伝学の手法が必要になってきます。 #11 そこで線虫の登場です。 #12 線虫にも立派な筋肉組織があります。 #13 そこに突然変異が入ったものは「動きの悪い」虫として簡単に見つけることができますので， #14 これまでに膨大な数の変異体が分離され #15 調べられてきました。 #16 ここでは，筋肉タンパク質の遺伝子が変異した線虫では，どのようにして #17 筋肉を形成するのか，また #18 筋肉遺伝子がどのように発現制御されるのかを説明します。,#13,そこに突然変異が入ったものは「動きの悪い」虫として簡単に見つけることができますので，,#14,これまでに膨大な数の変異体が分離され,explicit,原因・理由  
